{
  "id": "550e8400-e29b-41d4-a716-446655440001",
  "from": "sender@example.com",
  "to": [
    "recipient@example.com"
  ],
  "subject": "Project update for Q1",
  "body_text": "Please find the quarterly update attached.",
  "source": "test",
  "source_id": "test-email-001",
  "created_at": "2026-01-15T10:30:00Z",
  "updated_at": "2026-01-15T10:30:00Z"
}
