{
  "id": "550e8400-e29b-41d4-a716-446655440002",
  "from": "sender@example.com",
  "to": [
    "recipient@example.com"
  ],
  "cc": [
    "cc@example.com"
  ],
  "bcc": [],
  "subject": "Project update for Q1",
  "body_text": "Please find the quarterly update attached.",
  "body_html": "<p>Please find the quarterly update attached.</p>",
  "thread_id": "thread-abc-123",
  "labels": [
    "inbox",
    "important"
  ],
  "attachments": [
    {
      "file_id": "660e8400-e29b-41d4-a716-446655440001",
      "filename": "report.pdf",
      "mime_type": "application/pdf",
      "size": 245760
    }
  ],
  "source": "test",
  "source_id": "test-email-001",
  "extensions": {
    "com.gmail.connector": {
      "gmail_id": "18a1b2c3d4e5f6"
    }
  },
  "created_at": "2026-01-15T10:30:00Z",
  "updated_at": "2026-01-15T10:30:00Z"
}
